{
  "schema_version": "v0",
  "release_id": "release-pcs-v0.1-labtrust-qc",
  "release_candidate": "pcs-v0.1.0-rc1",
  "generated_at": "2026-05-18T21:29:17Z",
  "validation_profile": "labtrust-v0.1-release-chain",
  "workflow_profile_id": "labtrust.qc_release_v0.1",
  "chain_root": {
    "trace_hash": "sha256:c3e8a3dc4ad86d533de1dfa4ae7fe2a338c2cff3c945404c96a75216524d58cd",
    "certificate_id": "cert-trace-02b3a7c1-35f7-4d23-85c2-dfd60aff7693",
    "certified_bundle_hash": "sha256:b946dc0d81e164605bb27f39be47fe9489647f9876480e1cbcaab1f2ed7810e5",
    "signed_bundle_hash": "sha256:514d66748739e7b5d7778f20022be8cfafeb0650b0dcf94bd62fc0ba09e9eeeb"
  },
  "release_chain_validation_result": {
    "path": "release_chain_validation_result.v0.json",
    "sha256": "sha256:49c9508bcd082ebf38fc3aaf6dbd626d14d6403009ffc2d1a77c46211b161bd5"
  },
  "canonical_signed_bundle": {
    "path": "signed_science_claim_bundle.json",
    "sha256": "sha256:514d66748739e7b5d7778f20022be8cfafeb0650b0dcf94bd62fc0ba09e9eeeb"
  },
  "canonical_claim_id": "claim-pcs-qc-release-v0.1",
  "limitations_notice": "PCS v0.1 demonstrates a proof-carrying simulated lab workflow; it does not claim clinical validity or production certification.",
  "producer_repos": {
    "pcs_core": {
      "repo": "https://github.com/SentinelOps-CI/pcs-core",
      "commit": "17e414501b3e1c58e8fbde1fe89a828440a945d9"
    },
    "labtrust_gym": {
      "repo": "https://github.com/fraware/LabTrust-Gym",
      "commit": "17ed831acfd775889ab497d11004cceb083a9c2d"
    },
    "certifyedge": {
      "repo": "https://github.com/fraware/CertifyEdge",
      "commit": "635fca3771ad54fe3f8b49d1bb77ee35d0680ddc"
    },
    "provability_fabric": {
      "repo": "https://github.com/SentinelOps-CI/provability-fabric",
      "commit": "b0dbbbe1c110ec2301d452d2ef1074354cce170f"
    },
    "scientific_memory": {
      "repo": "https://github.com/fraware/scientific-memory",
      "commit": "0e059e934bc95bcc4dc0cb6593b18b07a28529a2"
    }
  },
  "artifacts": {
    "science_claim_bundle.certified.json": {
      "artifact_type": "ScienceClaimBundle.v0",
      "schema": "ScienceClaimBundle.v0.schema.json",
      "producer": "LabTrust-Gym",
      "source_repo": "https://github.com/fraware/LabTrust-Gym",
      "source_commit": "17ed831acfd775889ab497d11004cceb083a9c2d",
      "sha256": "sha256:b946dc0d81e164605bb27f39be47fe9489647f9876480e1cbcaab1f2ed7810e5"
    },
    "scientific_memory_import_report.json": {
      "artifact_type": "ScientificMemory.ImportReport.v0",
      "schema": "scientific_memory_import_report.json",
      "producer": "Scientific Memory",
      "source_repo": "https://github.com/fraware/scientific-memory",
      "source_commit": "0e059e934bc95bcc4dc0cb6593b18b07a28529a2",
      "sha256": "sha256:5e742f63492e8e27758ae59966f0b8e0934ac7d34b5384aed4f550d78397f315"
    },
    "signed_science_claim_bundle.json": {
      "artifact_type": "SignedScienceClaimBundle.v0",
      "schema": "SignedScienceClaimBundle.v0.schema.json",
      "producer": "Provability Fabric",
      "source_repo": "https://github.com/SentinelOps-CI/provability-fabric",
      "source_commit": "b0dbbbe1c110ec2301d452d2ef1074354cce170f",
      "sha256": "sha256:514d66748739e7b5d7778f20022be8cfafeb0650b0dcf94bd62fc0ba09e9eeeb"
    },
    "verification_result.json": {
      "artifact_type": "VerificationResult.v0",
      "schema": "VerificationResult.v0.schema.json",
      "producer": "Provability Fabric",
      "source_repo": "https://github.com/SentinelOps-CI/provability-fabric",
      "source_commit": "b0dbbbe1c110ec2301d452d2ef1074354cce170f",
      "sha256": "sha256:d3c0ab9eb10865ce3ce5ac94537d0412095346f6a8bb9611d2ccfe193a8adafa"
    }
  },
  "release_status": "Validated",
  "signature_or_digest": "sha256:5ab8e6b5d8a3abd13114073cda31247a617877081223db11acc854e6be9018a7"
}
